check,value
12 Kuzar Events Apollo's Harp,3.0
12 Kuzar Events Assassin,2.0
12 Kuzar Events Earth Bell,2.0
12 Kuzar Events Excalibur,1.0
12 Kuzar Events Holy Lance,2.0
12 Kuzar Events Masamune,2.0
12 Kuzar Events Sage's Staff,2.5
12 Kuzar Events Sasuke,4.0
12 Kuzar Events Wizard Rod,2.0
12 Kuzar Events Yoichi Bow,2.0
"5 potions in Wind Shrine, bottom left guy Potion",3.0
"8 potions, Pirate after Torna Canal Key acquired Potion",1.0
Aegis Shield Chest Aegis Shield,1.0
Ancient Library Chest Phoenix Down,2.0
Ancient Library Chest Stealth Suit,4.0
ArchaeAvis New,4.0
Bal Castle Chest Angel Gwn,3.0
Bal Castle Chest Hero Drink,2.0
Barrier Tower Chest 18000,2.0
Barrier Tower Chest 9000,2.0
Barrier Tower Chest Drain Sword,3.0
Barrier Tower Chest Gold Hairpin,3.0
Beginner's House Chest 100,2.5
Beginner's House Chest Ether,2.0
Beginner's House Chest Leather Shoes,4.0
Beginner's House Chest Tent,3.0
Black Choco Crystals Bard,2.0
Brave Blade Brave Blade,4.0
Byblos New,4.0
Carbuncle Crbnkl,1.0
Carwen Box Ice Rod,2.0
Carwen Pot 1000,2.0
Chancellor at Tycoon Healing Staff,3.0
Chicken Knife Chicken Knife,3.0
Crayclaw New,4.0
Earth Crystal Dancer,3.0
Earth Crystal Samurai,2.0
Exdeath's Castle Chest 8000,1.0
Exdeath's Castle Chest Diamond Shield,3.0
Exdeath's Castle Chest Ice Shield,1.0
Exdeath's Castle Chest Kotetsu,4.0
Fire Crystal Mediator,4.0
Fire Crystal Ninja,2.0
Flying Lonka Ruins Chest 5000,4.0
Flying Lonka Ruins Chest Elixir,3.0
Flying Lonka Ruins Chest Hi-Potion,1.0
Flying Lonka Ruins Chest Phoenix Down,1.0
Fork Tower L. Chest Wonder Wand,3.0
Fork Tower R. Chest Defender Sword,2.0
"Fork Tower, two Magics Flare",2.0
"Fork Tower, two Magics Holy",4.0
Gilgamesh 1 New,4.0
Gilgamesh 2 New,4.0
Gilgamesh 3 & Enkidou New,4.0
Gilgamesh 4 New,4.0
GoGo New,4.0
Great Trench Chest DragonFang,2.0
Great Trench Chest Flame Ring,4.0
Great Trench Chest Phoenix Down,3.0
Hiryuu Valley Chest 5000,1.0
Hiryuu Valley Chest 7000,3.0
Hiryuu Valley Chest Coronet,4.0
HiryuuPlant New,4.0
Ifrit New,4.0
Istory Falls Chest Aegis Shield,4.0
Istory Falls Chest Enhancer,3.0
Istory Falls Chest Ether,4.0
Istory Falls Chest Giant Drink,3.0
Istory Falls Chest Giant's Axe,4.0
Istory Falls Chest Pinwheel,3.0
Istory Falls Chest RuneEdge,1.0
Istory Falls Chest TurtleShell,1.0
Karnak Castle Chest 2000,2.0
Karnak Castle Chest Elf Cape,3.0
Karnak Castle Chest Elixir,3.0
Karnak Castle Chest Guardian,2.0
Karnak Castle Chest Gungnir,3.0
Karnak Castle Chest Ribbon,1.0
Karnak Castle Chest Shuriken,3.0
Karnak Castle Chest Thunder Scroll,3.0
Leviathan Esper Levia,2.0
Lone Wolf Chest Thunder Whip,3.0
Magic Song at Ancient Library Magic,4.0
Minotauros New,4.0
Mirage Vest from Chocobo Tour/Mirage Village Mirage Vest,2.0
Moogle Village Chest Cabin,2.0
Moogle Village Chest Elf Cape,2.0
Moogle Village Chest Ether,1.0
Moogle Village Chest Phoenix Down,3.0
Mua Forest Chest 9500,3.0
Mua Forest Chest Elixir,2.0
Mua Forest Chest Ether,1.0
Mua Forest Chest Flametongue,3.0
Mua Forest Chest Giant Drink,4.0
Mua Forest Chest Phoenix Down,3.0
Mua Forest Chest Soot,1.0
North Mountain Chest Phoenix Down,0.0
Odin New,4.0
Phoenix Phenix,1.0
Phoenix Tower Pot 10000,3.0
Phoenix Tower Pot 15000,2.0
Phoenix Tower Pot Avis Killer,1.0
Phoenix Tower Pot Phoenix Down,2.0
Pirate's Cave Chest 300,1.0
Pirate's Cave Chest Ether,1.0
Pirate's Cave Chest Leather Cap,1.0
Pirate's Cave Chest Tent,1.0
Power Song from Crescent Town Power,2.0
Puroboros New,4.0
Pyramid Chest 10000,3.0
Pyramid Chest 12000,1.0
Pyramid Chest 8000,4.0
Pyramid Chest 9000,3.0
Pyramid Chest Black Robe,2.0
Pyramid Chest Cabin,1.0
Pyramid Chest Crystal Armor,2.0
Pyramid Chest Cursed Ring,2.0
Pyramid Chest DarkMatter,3.0
Pyramid Chest DarkSuit,3.0
Pyramid Chest Earth Hammer,3.0
Pyramid Chest Elixir,4.0
Pyramid Chest Flame Shield,3.0
Pyramid Chest Gold Hairpin,4.0
Pyramid Chest Ice Shield,3.0
Pyramid Chest Thornlet,1.0
Pyramid Chest White Robe,1.0
Pyramid Top Pyramid Tablet,2.0
Requiem Song at Kelb Requiem,3.0
Ribbon from girl in Rugor Ribbon,3.0
Rift (Castle) Chest Red Shoes,2.0
Rift (Castle) Chest Running Shoes,2.0
Rift (Cave) Chest Coral Ring,2.0
Rift (Forest) Chest DragonFang,2.5
Rift (Forest) Chest Enhancer,4.0
Rift (Ruins) Chest Cabin,2.0
Rift (Ruins) Chest DarkMatter,2.0
Rift (Ruins) Chest Elixir,1.0
Rift (Ruins) Chest Ether,0.0
Ruined City Chest Size,2.0
Ship Graveyard Chest Phoenix Down,4.0
Ship Graveyard Chest Potion,2.0
Shiva New,4.0
Shiva Shiva,3.0
Siren New,4.0
Sol Cannon New,4.0
Solitary Island Chest 12000,2.0
Solitary Island Chest 9000,3.0
Solitary Island Chest Circlet,2.0
Solitary Island Chest DarkMatter,4.0
Solitary Island Chest DragonFang,4.0
Solitary Island Chest Ether,3.0
Solitary Island Chest Guard Ring,2.0
Solitary Island Chest Hi-Potion,1.0
Solitary Island Chest RisingSun,3.0
Speed Song at Surgate Speed,3.0
Steamship Chest Elixir,3.0
Steamship Chest Full Moon,1.0
Steamship Chest Mythril Glove,4.0
Steamship Chest Thief's Glove,2.0
Surgate Castle Chest 5000,1.0
Syldra Syldra,1.0
Temptation Song at Lix Charm,3.0
The Void Chest Ragnarok,1.0
Titan Titan,1.0
Toad Event Toad,3.0
Tule Barrel 150,4.0
Tule Barrel Potion,2.0
Tule Box Leather Shoes,2.0
Tule Bush Phoenix Down,2.0
Tycoon Castle Barrel Cabin,2.0
Tycoon Castle Barrel Phoenix Down,3.0
Tycoon Castle Cabin Cabin,1.0
Tycoon Castle Chest Shuriken,3.0
Tycoon Castle Pot Elixir,2.0
Tycoon Castle Pot Maiden's Kiss,3.0
Tycoon Meteor Chest Phoenix Down,2.0
Walse Castle Barrel Tent,3.0
Walse Castle Pot Drag,4.0
Walse Tower Chest GoGo,2.0
Walse Tower Chest Maiden's Kiss,2.0
Walse Tower Chest Silk robe,2.0
Walse Tower Chest Silver Armlet,1.0
Water Crystal Berserker,1.0
Water Crystal Samurai,2.0
Water Crystal Summoner,2.0
Water Crystal TimeMage,3.0
Wind Crystal BlackMage,0.0
Wind Crystal Knight,4.0
Wind Crystal Thief,4.0
Wind Shrine Chest Broadsword,4.0
Wind Shrine Chest Leather Cap,2.0
Wind Shrine Chest Staff,2.0
Wind Shrine Chest Tent,2.0
WingRaptor New,4.0
