check,reward,mib,reward_value,seed
Odin Odin,Slumber Sword,,2800.0,5465129
Phoenix Phenix,Tricorn Hat,,750.0,5465129
Bahamut Bahmut,Comet->Meteo,,0.0,5465129
Life (or Strength) Song from Crescent Town bard Vitality,Magic Lamp,,5000.0,5465129
Temptation Song at Lix Charm,Mute->Size->Bersk,,0.0,5465129
Love Song at Istory Love,FrogSong->TinySong->MoonFlut,,0.0,5465129
Requiem Song at Kelb Requiem,Bolt Black Magic Progressive,,0.0,5465129
Speed Song at Surgate Speed,Speed Drink,,55.0,5465129
Magic Song at Ancient Library Magic,Cover,,0.0,5465129
Power Song from Crescent Town Power,Power Wrist,,1250.0,5465129
Hero Song from Crescent Town Hero,Running Shoes,,25000.0,5465129
"Fork Tower, two Magics Holy",Summon Ability Progressive,,0.0,5465129
"Fork Tower, two Magics Flare",Berserker Job Crystal,,0.0,5465129
Meteo Meteo,Diamond Shield,,3000.0,5465129
"5 potions in Wind Shrine, bottom left guy Potion",Kotetsu,,5900.0,5465129
"8 potions, Pirate after Torna Canal Key acquired Potion",Venom->Drain->Break,,0.0,5465129
Chancellor at Tycoon Healing Staff,Revivify,,75.0,5465129
Magisa & Forza Mythril Helm,White Ability Progressive,,0.0,5465129
CornaJar at Kelb CornaJar,Thor Hammer,,15000.0,5465129
Ribbon from girl in Rugor Ribbon,Cabin,,300.0,5465129
Mirage Vest from Chocobo Tour/Mirage Village Mirage Vest,Dimen Ability Progressive,,0.0,5465129
12 Kuzar Events Assassin,Potion,,20.0,5465129
12 Kuzar Events Apollo's Harp,Leather Shoes,,35.0,5465129
12 Kuzar Events Excalibur,Bard's Surplice,,500.0,5465129
12 Kuzar Events Flame Whip,BlueMage Job Crystal,,0.0,5465129
12 Kuzar Events Earth Bell,Lamia's Tiara,,1250.0,5465129
12 Kuzar Events Holy Lance,Flash->Time Slip->DethClaw,,0.0,5465129
12 Kuzar Events Masamune,Thunder Bow,,1250.0,5465129
12 Kuzar Events Wizard Rod,FrogSong->TinySong->MoonFlut,,0.0,5465129
12 Kuzar Events Rune Axe,Regen->Float->Reset->Xzone,,0.0,5465129
12 Kuzar Events Sage's Staff,Antdt->Image->Heal,,0.0,5465129
12 Kuzar Events Sasuke,GrnBeret,,1250.0,5465129
12 Kuzar Events Yoichi Bow,Analyze,,0.0,5465129
Shiva Shiva,Air Lance,,3400.0,5465129
Ifrit Ifrit,Comet->Meteo,,0.0,5465129
Water Crystal Samurai,Epee Sword,,4200.0,5465129
Water Crystal Berserker,Dimen Ability Progressive,,0.0,5465129
Water Crystal MysticKnight,Animals->Aim->X-Fight,,0.0,5465129
Water Crystal TimeMage,Ice Rod,,375.0,5465129
Water Crystal Summoner,Bronze Armor,,200.0,5465129
Brave Blade Brave Blade,GbnPnch->Emision->Missle->Blwfsh,,0.0,5465129
Chicken Knife Chicken Knife,Charm->Hero@Song,,0.0,5465129
Tycoon Castle Cabin Cabin,MysticKnight Job Crystal,,0.0,5465129
Walse Tower Chest GoGo,Forged,,7400.0,5465129
Pyramid Top Pyramid Tablet,Running Shoes,,25000.0,5465129
Toad Event Toad,DblLance,,5400.0,5465129
Aegis Shield Chest Aegis Shield,Gauntlets,,1500.0,5465129
Lone Wolf Barrel Cabin,War Hammer,,3200.0,5465129
Lone Wolf Chest Thunder Whip,Thunder Whip,,1100.0,5465129
Moat Item Epee,DiamndPlt,,3000.0,5465129
Shop Backdoor Lamia Harp,Thunder Whip,,1100.0,5465129
Top of the Falls Magic Lamp,Red Shoes,,4900.0,5465129
Wind Shrine Chest Broadsword,Black Ability Progressive,,0.0,5465129
Beginner's House Chest Ether,Tricorn Hat,,750.0,5465129
Beginner's House Chest 100,Earth Bell,,4500.0,5465129
Beginner's House Chest Potion,Monk Job Crystal,,0.0,5465129
Beginner's House Chest Phoenix Down,Wind Spear,MIB,2700.0,5465129
Beginner's House Chest Tent,Rainbow Dress,,2900.0,5465129
Beginner's House Chest Leather Shoes,Venom Rod,,750.0,5465129
Pirate's Cave Chest Leather Cap,IceBrand,,5500.0,5465129
Pirate's Cave Chest Tent,2500 gil,,2500.0,5465129
Pirate's Cave Chest Ether,Epee Sword,,4200.0,5465129
Pirate's Cave Chest 300,490 gil,,490.0,5465129
Wind Shrine Chest Tent,9000 gil,,9000.0,5465129
Wind Shrine Chest Leather Cap,10000 gil,,10000.0,5465129
Wind Shrine Chest Staff,Mythril Hammer,,525.0,5465129
Tule Barrel 150,DragonFang,,2500.0,5465129
Tule Box Leather Shoes,Power->Vitality Song,,0.0,5465129
Tule Barrel Potion,Black Ability Progressive,,0.0,5465129
Tule Box Tent,Equip Harps,,0.0,5465129
Tule Bush Phoenix Down,Mute->Psych->Holy Sword,,0.0,5465129
Ship Graveyard Chest Flail,Water Scroll,,100.0,5465129
Ship Graveyard Chest Phoenix Down,Bandana,,1750.0,5465129
Ship Graveyard Chest Tent,Silk robe,,250.0,5465129
Ship Graveyard Box 990,Maiden's Kiss,,30.0,5465129
Ship Graveyard Chest Potion,Silk robe,,250.0,5465129
Ship Graveyard Chest Antidote,Bronze Armor,,200.0,5465129
Carwen Barrel Antidote,Antidote,,15.0,5465129
Carwen Box Ice Rod,Sleep->Psych->Doom,,0.0,5465129
Carwen Pot 1000,2000 gil,,2000.0,5465129
North Mountain Chest Soft,2000 gil,,2000.0,5465129
North Mountain Chest Phoenix Down,9000 gil,,9000.0,5465129
Walse Town Pot Glasses,9900 gil,,9900.0,5465129
Tycoon Castle Pot Hi-Potion,Gaia Gear,,1000.0,5465129
Tycoon Castle Pot Ether,Sleep->Bio->Flare Sword,,0.0,5465129
Tycoon Castle Barrel Elixir,Air Blade,,50.0,5465129
Tycoon Castle Barrel Phoenix Down,Phoenix Down,,500.0,5465129
Tycoon Castle Barrel Cabin,Chemist Job Crystal,,0.0,5465129
Tycoon Castle Pot Elixir,Chicken Knife,,12500.0,5465129
Tycoon Castle Pot Phoenix Down,Phoenix Down,,500.0,5465129
Tycoon Castle Pot Maiden's Kiss,100 gil,,100.0,5465129
Tycoon Castle Chest Shuriken,300 gil,,300.0,5465129
Tycoon Castle Chest Giyaman,1000 gil,,1000.0,5465129
Tycoon Castle Chest Katana,Flame Shield,,20000.0,5465129
Walse Castle Chest Elf Cape,Sage's Staff,,10000.0,5465129
Walse Castle Pot 1000,Yoichi Bow,,10000.0,5465129
Walse Castle Pot Drag,Golden Helm,,1750.0,5465129
Walse Castle Box 490,Battle Axe,,325.0,5465129
Walse Castle Barrel Tent,Darkness Bow,,1900.0,5465129
Walse Castle Barrel Phoenix Down,Genji Gloves,,7500.0,5465129
Walse Tower Chest Silk robe,Remora->Shoat->Levia,,0.0,5465129
Walse Tower Chest Maiden's Kiss,White Ability Progressive,,0.0,5465129
Walse Tower Chest Silver Armlet,Terrain,,0.0,5465129
Walse Tower Chest Ether,Iron Helm,,175.0,5465129
Tycoon Meteor Chest Phoenix Down,Red1->Red2->Red3->X-Magic,,0.0,5465129
Karnak Castle Chest Gungnir,Killer Bow,MIB,2500.0,5465129
Karnak Castle Chest Thunder Scroll,DarkHood,MIB,3250.0,5465129
Karnak Castle Chest 2000,Healing Staff,MIB,450.0,5465129
Karnak Castle Chest Elixir,Rod,MIB,100.0,5465129
Karnak Castle Chest Ribbon,Iron Helm,MIB,175.0,5465129
Karnak Castle Chest Shuriken,Dragoon Lance,MIB,15000.0,5465129
Karnak Castle Chest Elf Cape,Broadsword,MIB,140.0,5465129
Karnak Castle Chest Guardian,Venom Axe,MIB,4800.0,5465129
Karnak Town Barrel Fire Rod,5000 gil,,5000.0,5465129
Steamship Chest Cabin,MgcSword Ability Progressive,,0.0,5465129
Steamship Chest Phoenix Down,9000 gil,,9000.0,5465129
Steamship Chest Elixir,Bard Job Crystal,,0.0,5465129
Steamship Chest GrnBeret,HP +X%,,0.0,5465129
Steamship Chest Thief's Glove,Ice Rod,,375.0,5465129
Ancient Library Chest Ether,5000 gil,,5000.0,5465129
Ancient Library Chest Phoenix Down,4400 gil,,4400.0,5465129
Ancient Library Chest Stealth Suit,Kodachi,,2550.0,5465129
Jacole Cave Chest Shuriken,990 gil,,990.0,5465129
Jacole Cave Chest Tent,9500 gil,,9500.0,5465129
Ruined City Chest Shuriken,4900 gil,,4900.0,5465129
Ruined City Chest Size,Vampire->MindBlst->WhiteWind,,0.0,5465129
Flying Lonka Ruins Chest Golden Armor,BlackMage Job Crystal,,0.0,5465129
Flying Lonka Ruins Chest Elixir,Gauntlets,,1500.0,5465129
Flying Lonka Ruins Chest Phoenix Down,Bronze Shield,,145.0,5465129
Flying Lonka Ruins Chest Golden Shield,Leather Shoes,,35.0,5465129
Steamship Chest Mythril Glove,Revivify,,75.0,5465129
Steamship Chest Full Moon,Broadsword,,140.0,5465129
Flying Lonka Ruins Chest Hi-Potion,Void->Demi->Qrter->Old,,0.0,5465129
Flying Lonka Ruins Chest 5000,Maiden's Kiss,,30.0,5465129
Flying Lonka Ruins Chest Shuriken,10000 gil,,10000.0,5465129
Flying Lonka Ruins Chest Ancient Sword,Flametongue,,5000.0,5465129
Flying Lonka Ruins Chest Full Moon,Venom->Drain->Break,,0.0,5465129
Flying Lonka Ruins Chest Power Wrist,IceBrand,,5500.0,5465129
Flying Lonka Ruins Chest Ether,TurtleShell,,75.0,5465129
Flying Lonka Ruins Chest Cabin,Flail,,390.0,5465129
Exdeath's Castle Chest Ether,Regen->Float->Reset->Xzone,,0.0,5465129
Exdeath's Castle Chest Diamond Shield,Equip Swords,,0.0,5465129
Exdeath's Castle Chest Ice Shield,Equip Axes,,0.0,5465129
Exdeath's Castle Chest Elixir,Control,,0.0,5465129
Exdeath's Castle Chest Gale Bow,Ice Sword Magic Progressive,,0.0,5465129
Exdeath's Castle Chest IceBrand,Regen->Float->Reset->Xzone,,0.0,5465129
Exdeath's Castle Chest Kotetsu,Brave Blade,,15000.0,5465129
Exdeath's Castle Chest 9900,Knight Job Crystal,,0.0,5465129
Exdeath's Castle Chest 8000,Cabin,,300.0,5465129
Exdeath's Castle Chest DblLance,15000 gil,,15000.0,5465129
Exdeath's Castle Chest Partisan,Apollo's Harp,,10000.0,5465129
Exdeath's Castle Chest Pinwheel,Bronze Helm,,125.0,5465129
Moogle Cave Chest 4400,8000 gil,,8000.0,5465129
Moogle Cave Chest Phoenix Down,IceBrand,,5500.0,5465129
Moogle Village Chest Cabin,Mute->Size->Bersk,,0.0,5465129
Moogle Village Chest Dancing Dagger,18000 gil,,18000.0,5465129
Moogle Village Chest 1,Chocob->Titan->Golem->Odin,,0.0,5465129
Moogle Village Chest 10000,Wind Spear,,2700.0,5465129
Moogle Village Chest Phoenix Down,Judgement Staff,,15000.0,5465129
Moogle Village Chest Ether,SwdSlap,,0.0,5465129
Moogle Village Chest Elf Cape,Air Lance,,3400.0,5465129
Bal Castle Chest Angel Gwn,Toad->Bio->Flare,,0.0,5465129
Bal Castle Chest Hero Drink,Tame,,0.0,5465129
Bal Castle Chest Exit,Magic->Love@Song,,0.0,5465129
Hiryuu Valley Skull Bone Mail,Phoenix Down,,500.0,5465129
Hiryuu Valley Chest 5000,Summon Ability Progressive,,0.0,5465129
Hiryuu Valley Chest Cabin,Shiva->Ramuh->Ifrit->Bahmut,,0.0,5465129
Hiryuu Valley Chest 7000,100 gil,,100.0,5465129
Hiryuu Valley Chest Coronet,9000 gil,,9000.0,5465129
Hiryuu Valley Chest Air Blade,Scan->Charm->Holy,,0.0,5465129
Hiryuu Valley Chest Phoenix Down,1000 gil,,1000.0,5465129
Surgate Castle Chest 5000,20000 gil,,20000.0,5465129
Surgate Castle Chest Float,Condemn->Roulette->AquaRake,,0.0,5465129
Barrier Tower Chest Drain Sword,RuneEdge,MIB,9500.0,5465129
Barrier Tower Chest 9000,Sleep->Bio->Flare Sword,,0.0,5465129
Barrier Tower Chest 18000,Wind Spear,MIB,2700.0,5465129
Barrier Tower Chest Gold Hairpin,Bronze Armor,,200.0,5465129
Mua Town Barrel Guardian,Guardian,,1300.0,5465129
Mua Forest Chest 2500,Giyaman,,250.0,5465129
Mua Forest Chest Ether,Summoner Job Crystal,,0.0,5465129
Mua Forest Chest 4900,Dance,,0.0,5465129
Mua Forest Chest Phoenix Down,DrgnSwd,,0.0,5465129
Mua Forest Chest 9500,Earth Hammer,,6400.0,5465129
Mua Forest Chest Soot,2000 gil,,2000.0,5465129
Mua Forest Chest Flametongue,Coronet,,6000.0,5465129
Mua Forest Chest Cabin,Fire Sword Magic Progressive,,0.0,5465129
Mua Forest Chest Giant Drink,Giant's Axe,,20000.0,5465129
Mua Forest Chest Elixir,Elixir,,25000.0,5465129
Mua Forest Chest Morning Star,8000 gil,,8000.0,5465129
Solitary Island Chest Ether,Jump,,0.0,5465129
Solitary Island Chest DragonFang,Protect Drink,,55.0,5465129
Pyramid Chest Elixir,150 gil,,150.0,5465129
Pyramid Chest Black Robe,Whip,MIB,550.0,5465129
Pyramid Chest Thornlet,Flame Scroll,,100.0,5465129
Pyramid Chest DarkMatter,Whip,,550.0,5465129
Pyramid Chest Crystal Armor,Guardian,MIB,1300.0,5465129
Pyramid Chest Cursed Ring,Golden Shield,MIB,1500.0,5465129
Pyramid Chest Ice Shield,DragonFang,,2500.0,5465129
Pyramid Chest Flame Shield,Flame Shield,,20000.0,5465129
Pyramid Chest White Robe,White Robe,MIB,4000.0,5465129
Pyramid Chest DarkSuit,Sage's Staff,MIB,10000.0,5465129
Pyramid Chest 9000,Flail,MIB,390.0,5465129
Pyramid Chest 8000,Bolt Black Magic Progressive,,0.0,5465129
Pyramid Chest Earth Hammer,Cursed Ring,,2500.0,5465129
Pyramid Chest 10000,Ice Rod,MIB,375.0,5465129
Pyramid Chest Cabin,Giant Drink,MIB,55.0,5465129
Pyramid Chest 12000,Kodachi,,2550.0,5465129
Pyramid Chest Guard Ring,Wind Spear,MIB,2700.0,5465129
Pyramid Chest Ribbon,Coral Ring,,25000.0,5465129
Pyramid Chest Gold Hairpin,OmegaMedl,,0.0,5465129
Solitary Island Chest 12000,Soft,,75.0,5465129
Solitary Island Chest Hi-Potion,Throw,,0.0,5465129
Solitary Island Chest Protect Drink,Ninja Job Crystal,,0.0,5465129
Solitary Island Chest BeastKiller,Regen->Float->Reset->Xzone,,0.0,5465129
Solitary Island Chest RisingSun,Ramuh,,0.0,5465129
Solitary Island Chest Guard Ring,Lamia's Harp,MIB,1600.0,5465129
Solitary Island Chest Crystal Helm,Bone Mail,,15000.0,5465129
Solitary Island Chest 9000,Sasuke,,10000.0,5465129
Solitary Island Chest Elixir,Shiva->Ramuh->Ifrit->Bahmut,,0.0,5465129
Solitary Island Chest DarkMatter,Armor->Shell->Wall->Dispel,,0.0,5465129
Solitary Island Chest Circlet,Tricorn Hat,MIB,750.0,5465129
Fork Tower L. Chest Ether,Vampire->MindBlst->WhiteWind,,0.0,5465129
Fork Tower L. Chest Wonder Wand,GbnPnch->Emision->Missle->Blwfsh,,0.0,5465129
Fork Tower R. Chest Hi-Potion,12000 gil,,12000.0,5465129
Fork Tower R. Chest Defender Sword,Mythril Staff,,250.0,5465129
Great Trench Chest Water Scroll,Venom->Drain->Break Sword,,0.0,5465129
Great Trench Chest Flame Ring,10000 gil,,10000.0,5465129
Great Trench Chest DragonFang,Thunder Rod,,375.0,5465129
Great Trench Chest Ether,LuckMallet,,25.0,5465129
Great Trench Chest Phoenix Down,Chocob->Titan->Golem->Odin,,0.0,5465129
Great Trench Chest Kaiser Knuckles,Toad->Bio->Flare,,0.0,5465129
Istory Falls Chest Ether,Darkness Bow,,1900.0,5465129
Istory Falls Chest TurtleShell,Chain Whip,,1650.0,5465129
Istory Falls Chest Air Lance,Mantra,,0.0,5465129
Istory Falls Chest Giant Drink,Dagger,,150.0,5465129
Istory Falls Chest RuneEdge,Brawl,,0.0,5465129
Istory Falls Chest Guard Ring,Giant Drink,,55.0,5465129
Istory Falls Chest Wall Ring,Wall Ring,,10000.0,5465129
Istory Falls Chest Phoenix Down,RisingSun,,5500.0,5465129
Istory Falls Chest Enhancer,12000 gil,,12000.0,5465129
Istory Falls Chest 12000,L4Qrter->L3Flare->L2Old->L5Doom,,0.0,5465129
Istory Falls Chest Artemis Bow,GuardOff->Hammer->MghtyGrd,,0.0,5465129
Istory Falls Chest Pinwheel,Condemn->Roulette->AquaRake,,0.0,5465129
Istory Falls Chest Aegis Shield,10000 gil,,10000.0,5465129
Istory Falls Chest Giant's Axe,Crystal Armor,,6000.0,5465129
Phoenix Tower Pot 5000,Soft,,75.0,5465129
Phoenix Tower Pot Phoenix Down,Tricorn Hat,MIB,750.0,5465129
Phoenix Tower Pot 10000,Bronze Shield,,145.0,5465129
Phoenix Tower Pot 15000,Staff,MIB,100.0,5465129
Phoenix Tower Pot 20000,Thunder Scroll,MIB,100.0,5465129
Phoenix Tower Pot Avis Killer,Javelin,,50.0,5465129
Phoenix Tower Pot 25000,Potion,MIB,20.0,5465129
Mirage Village Barrel Thief Knife,12000 gil,,12000.0,5465129
Rift (Ruins) Chest Ether,12000 gil,,12000.0,5465129
Rift (Ruins) Chest Cabin,Giant's Gloves,,2500.0,5465129
Rift (Ruins) Chest Elixir,Assassin,,10000.0,5465129
Rift (Ruins) Chest DarkMatter,Crystal Shield,,4500.0,5465129
Rift (Ruins) Chest Drain Sword,Mediator Job Crystal,,0.0,5465129
Rift (Forest) Chest DragonFang,Tiger Mask,,2500.0,5465129
Rift (Forest) Chest Ribbon,DmgFloor,,0.0,5465129
Rift (Forest) Chest Enhancer,GilToss,,0.0,5465129
Rift (Forest) Chest Lillith Rod,1000 gil,,1000.0,5465129
Rift (Cave) Chest Angel Ring,Lamia's Tiara,,1250.0,5465129
Rift (Cave) Chest Coral Ring,GbnPnch->Emision->Missle->Blwfsh,,0.0,5465129
Rift (Castle) Chest Thor Hammer,8000 gil,,8000.0,5465129
Rift (Castle) Chest Running Shoes,Golden Armor,,2000.0,5465129
Rift (Castle) Chest Red Shoes,Fire Black Magic Progressive,,0.0,5465129
Rift (Castle) Chest Rainbow Dress,DarkSuit,,4500.0,5465129
Rift (Castle) Chest ManEater,WhiteMage Job Crystal,,0.0,5465129
The Void Chest Pinwheel,Coronet,,6000.0,5465129
The Void Chest Elixir,100 gil,,100.0,5465129
The Void Chest Ragnarok,Training Suit,MIB,225.0,5465129
Byblos New,Mirage Vest,,5000.0,5465129
WingRaptor New,Crystal Helm,,5250.0,5465129
AdamanTiMi New,Assassin,,10000.0,5465129
Sol Cannon New,25000 gil,,25000.0,5465129
ArchaeAvis New,25000 gil,,25000.0,5465129
Puroboros New,DblLance,,5400.0,5465129
Tyrasaurus New,Masamune,,10000.0,5465129
HiryuuPlant New,Wizard Rod,,10000.0,5465129
Gilgamesh 3 & Enkidou New,Dragon's Whisker,,2200.0,5465129
Guardians New,DarkSuit,,4500.0,5465129
Gilgamesh 4 New,Mirage Vest,,5000.0,5465129
Antlion New,Sasuke,,10000.0,5465129
Merugene New,Tempest,,15000.0,5465129
Omniscient New,Holy Lance,,10000.0,5465129
GoGo New,Genji Shield,,10000.0,5465129
Ifrit New,Genji Shield,,10000.0,5465129
Shiva New,Murasume,,10000.0,5465129
Crayclaw New,Gold Hairpin,,15000.0,5465129
Wind Crystal Knight,Tame,,0.0,9551699
Wind Crystal BlueMage,Iron Shield,,195.0,9551699
Wind Crystal BlackMage,Evade,,0.0,9551699
Wind Crystal WhiteMage,Analyze,,0.0,9551699
Wind Crystal Monk,Venom->Drain->Break Sword,,0.0,9551699
Wind Crystal Thief,Giant's Gloves,,2500.0,9551699
Fire Crystal Mediator,RuneEdge,,9500.0,9551699
Fire Crystal Geomancer,Flail,,390.0,9551699
Fire Crystal Ninja,Sleep->Bio->Flare Sword,,0.0,9551699
Black Choco Crystals Bard,Ice Black Magic Progressive,,0.0,9551699
Black Choco Crystals Hunter,Charm->Hero@Song,,0.0,9551699
Earth Crystal Samurai,Rod,,100.0,9551699
Earth Crystal Dragoon,Bolt Sword Magic Progressive,,0.0,9551699
Earth Crystal Chemist,Cure White Magic Progressive,,0.0,9551699
Earth Crystal Dancer,Toad->Bio->Flare,,0.0,9551699
Leviathan Esper Levia,Epee Sword,,4200.0,9551699
Titan Titan,MgcSword Ability Progressive,,0.0,9551699
Carbuncle Crbnkl,Antdt->Image->Heal,,0.0,9551699
Syldra Syldra,FrogSong->TinySong->MoonFlut,,0.0,9551699
Odin Odin,Iron Armor,,250.0,9551699
Phoenix Phenix,Fire Sword Magic Progressive,,0.0,9551699
Bahamut Bahmut,DragonFang,,2500.0,9551699
Life (or Strength) Song from Crescent Town bard Vitality,Mantra,,0.0,9551699
Temptation Song at Lix Charm,Red1->Red2->Red3->X-Magic,,0.0,9551699
Love Song at Istory Love,Bandana,,1750.0,9551699
Requiem Song at Kelb Requiem,Running Shoes,,25000.0,9551699
Speed Song at Surgate Speed,Diamond Armor,,4000.0,9551699
Magic Song at Ancient Library Magic,Cover,,0.0,9551699
Power Song from Crescent Town Power,Dimen Ability Progressive,,0.0,9551699
Hero Song from Crescent Town Hero,Vampire->MindBlst->WhiteWind,,0.0,9551699
"Fork Tower, two Magics Holy",Revivify,,75.0,9551699
"Fork Tower, two Magics Flare",Partisan,,5100.0,9551699
Meteo Meteo,Geomancer Job Crystal,,0.0,9551699
"5 potions in Wind Shrine, bottom left guy Potion",Cure White Magic Progressive,,0.0,9551699
"8 potions, Pirate after Torna Canal Key acquired Potion",Slow->Stop->Slow2,,0.0,9551699
Chancellor at Tycoon Healing Staff,GbnPnch->Emision->Missle->Blwfsh,,0.0,9551699
Magisa & Forza Mythril Helm,White Ability Progressive,,0.0,9551699
CornaJar at Kelb CornaJar,Comet->Meteo,,0.0,9551699
Ribbon from girl in Rugor Ribbon,Kick,,0.0,9551699
Mirage Vest from Chocobo Tour/Mirage Village Mirage Vest,Silver Harp,,400.0,9551699
12 Kuzar Events Assassin,Armor->Shell->Wall->Dispel,,0.0,9551699
12 Kuzar Events Apollo's Harp,White Ability Progressive,,0.0,9551699
12 Kuzar Events Excalibur,Bard's Surplice,,500.0,9551699
12 Kuzar Events Flame Whip,Hunter Job Crystal,,0.0,9551699
12 Kuzar Events Earth Bell,????->Fusion->Exploder->DrkShock,,0.0,9551699
12 Kuzar Events Holy Lance,Venom->Drain->Break Sword,,0.0,9551699
12 Kuzar Events Masamune,Gungnir,,4050.0,9551699
12 Kuzar Events Wizard Rod,Sleep->Psych->Doom,,0.0,9551699
12 Kuzar Events Rune Axe,Silver Bow,,750.0,9551699
12 Kuzar Events Sage's Staff,Rune Chime,,10000.0,9551699
12 Kuzar Events Sasuke,FrogSong->TinySong->MoonFlut,,0.0,9551699
12 Kuzar Events Yoichi Bow,Pinwheel,,12500.0,9551699
Shiva Shiva,Equip Harps,,0.0,9551699
Ifrit Ifrit,Mythril Glove,,300.0,9551699
Water Crystal Samurai,Thief's Glove,,1500.0,9551699
Water Crystal Berserker,Silver Armlet,,250.0,9551699
Water Crystal MysticKnight,Condemn->Roulette->AquaRake,,0.0,9551699
Water Crystal TimeMage,Speed->Requiem Song,,0.0,9551699
Water Crystal Summoner,Dimen Ability Progressive,,0.0,9551699
Brave Blade Brave Blade,Diamond Helm,,3500.0,9551699
Chicken Knife Chicken Knife,Earth Bell,,4500.0,9551699
Tycoon Castle Cabin Cabin,BeastKiller,,7500.0,9551699
Walse Tower Chest GoGo,Terrain,,0.0,9551699
Pyramid Top Pyramid Tablet,Bard Job Crystal,,0.0,9551699
Toad Event Toad,Glasses,,125.0,9551699
Aegis Shield Chest Aegis Shield,Aegis Shield,,2250.0,9551699
Lone Wolf Barrel Cabin,MP +X%,,0.0,9551699
Lone Wolf Chest Thunder Whip,Thunder Whip,,1100.0,9551699
Moat Item Epee,Equip Bows,,0.0,9551699
Shop Backdoor Lamia Harp,Regen->Float->Reset->Xzone,,0.0,9551699
Top of the Falls Magic Lamp,Sylph->Crbnkl->Phenix->Syldra,,0.0,9551699
Wind Shrine Chest Broadsword,Staff of Light,,1350.0,9551699
Beginner's House Chest Ether,L4Qrter->L3Flare->L2Old->L5Doom,,0.0,9551699
Beginner's House Chest 100,Magic Lamp,,5000.0,9551699
Beginner's House Chest Potion,Black Ability Progressive,,0.0,9551699
Beginner's House Chest Phoenix Down,BlueMage Job Crystal,,0.0,9551699
Beginner's House Chest Tent,Epee Sword,,4200.0,9551699
Beginner's House Chest Leather Shoes,Ribbon,,17500.0,9551699
Pirate's Cave Chest Leather Cap,TurtleShell,,75.0,9551699
Pirate's Cave Chest Tent,Aero Blue Magic Progressive,,0.0,9551699
Pirate's Cave Chest Ether,2000 gil,,2000.0,9551699
Pirate's Cave Chest 300,Summon Ability Progressive,,0.0,9551699
Wind Shrine Chest Tent,10000 gil,,10000.0,9551699
Wind Shrine Chest Leather Cap,5000 gil,,5000.0,9551699
Wind Shrine Chest Staff,Venom->Drain->Break,,0.0,9551699
Tule Barrel 150,Leather Shoes,,35.0,9551699
Tule Box Leather Shoes,Fire Rod,,375.0,9551699
Tule Barrel Potion,Diamond Helm,,3500.0,9551699
Tule Box Tent,Aegis Shield,MIB,2250.0,9551699
Tule Bush Phoenix Down,Eyedrop,,10.0,9551699
Ship Graveyard Chest Flail,2000 gil,,2000.0,9551699
Ship Graveyard Chest Phoenix Down,Dimen Ability Progressive,,0.0,9551699
Ship Graveyard Chest Tent,Chocob->Titan->Golem->Odin,,0.0,9551699
Ship Graveyard Box 990,490 gil,,490.0,9551699
Ship Graveyard Chest Potion,GrnBeret,,1250.0,9551699
Ship Graveyard Chest Antidote,Power->Vitality Song,,0.0,9551699
Carwen Barrel Antidote,Dragoon Job Crystal,,0.0,9551699
Carwen Box Ice Rod,10000 gil,,10000.0,9551699
Carwen Pot 1000,Venom Rod,,750.0,9551699
North Mountain Chest Soft,2-Handed,,0.0,9551699
North Mountain Chest Phoenix Down,10000 gil,,10000.0,9551699
Walse Town Pot Glasses,5000 gil,,5000.0,9551699
Tycoon Castle Pot Hi-Potion,Flirt,,0.0,9551699
Tycoon Castle Pot Ether,MP +X%,,0.0,9551699
Tycoon Castle Barrel Elixir,9500 gil,,9500.0,9551699
Tycoon Castle Barrel Phoenix Down,Phoenix Down,,500.0,9551699
Tycoon Castle Barrel Cabin,Equip Ribbon,,0.0,9551699
Tycoon Castle Pot Elixir,Chicken Knife,,12500.0,9551699
Tycoon Castle Pot Phoenix Down,Phoenix Down,,500.0,9551699
Tycoon Castle Pot Maiden's Kiss,Tinkerbell,,750.0,9551699
Tycoon Castle Chest Shuriken,Berserk,,0.0,9551699
Tycoon Castle Chest Giyaman,Coral Sword,,1400.0,9551699
Tycoon Castle Chest Katana,Knight Job Crystal,,0.0,9551699
Walse Castle Chest Elf Cape,Scan->Charm->Holy,,0.0,9551699
Walse Castle Pot 1000,Diamond Helm,,3500.0,9551699
Walse Castle Pot Drag,Preemptive,,0.0,9551699
Walse Castle Box 490,Protect Drink,,55.0,9551699
Walse Castle Barrel Tent,Gauntlets,,1500.0,9551699
Walse Castle Barrel Phoenix Down,Red1->Red2->Red3->X-Magic,,0.0,9551699
Walse Tower Chest Silk robe,Ether,,750.0,9551699
Walse Tower Chest Maiden's Kiss,Scan->Charm->Holy,,0.0,9551699
Walse Tower Chest Silver Armlet,Black Ability Progressive,,0.0,9551699
Walse Tower Chest Ether,Ether,,750.0,9551699
Tycoon Meteor Chest Phoenix Down,Bandana,,1750.0,9551699
Karnak Castle Chest Gungnir,Thornlet,MIB,10000.0,9551699
Karnak Castle Chest Thunder Scroll,Thunder Whip,MIB,1100.0,9551699
Karnak Castle Chest 2000,Assassin,MIB,10000.0,9551699
Karnak Castle Chest Elixir,Gold Hairpin,MIB,15000.0,9551699
Karnak Castle Chest Ribbon,Diamond Shield,MIB,3000.0,9551699
Karnak Castle Chest Shuriken,Genji Gloves,MIB,7500.0,9551699
Karnak Castle Chest Elf Cape,Gold Hairpin,,15000.0,9551699
Karnak Castle Chest Guardian,DiamndPlt,MIB,3000.0,9551699
Karnak Town Barrel Fire Rod,AntiMagic Bow,,5000.0,9551699
Steamship Chest Cabin,9000 gil,,9000.0,9551699
Steamship Chest Phoenix Down,Soot,,50.0,9551699
Steamship Chest Elixir,Equip Rods,,0.0,9551699
Steamship Chest GrnBeret,Shoat,,0.0,9551699
Steamship Chest Thief's Glove,5000 gil,,5000.0,9551699
Ancient Library Chest Ether,Morning Star,,3900.0,9551699
Ancient Library Chest Phoenix Down,2000 gil,,2000.0,9551699
Ancient Library Chest Stealth Suit,Staff of Light,,1350.0,9551699
Jacole Cave Chest Shuriken,12000 gil,,12000.0,9551699
Jacole Cave Chest Tent,Thunder Rod,,375.0,9551699
Ruined City Chest Shuriken,9000 gil,,9000.0,9551699
Ruined City Chest Size,5000 gil,,5000.0,9551699
Flying Lonka Ruins Chest Golden Armor,DiamndPlt,,3000.0,9551699
Flying Lonka Ruins Chest Elixir,????->Fusion->Exploder->DrkShock,,0.0,9551699
Flying Lonka Ruins Chest Phoenix Down,9900 gil,,9900.0,9551699
Flying Lonka Ruins Chest Golden Shield,8000 gil,,8000.0,9551699
Steamship Chest Mythril Glove,2000 gil,,2000.0,9551699
Steamship Chest Full Moon,Earth Bell,,4500.0,9551699
Flying Lonka Ruins Chest Hi-Potion,12000 gil,,12000.0,9551699
Flying Lonka Ruins Chest 5000,Smoke,,0.0,9551699
Flying Lonka Ruins Chest Shuriken,Whip,,550.0,9551699
Flying Lonka Ruins Chest Ancient Sword,Elixir,,25000.0,9551699
Flying Lonka Ruins Chest Full Moon,GbnPnch->Emision->Missle->Blwfsh,,0.0,9551699
Flying Lonka Ruins Chest Power Wrist,Angel Gwn,,1500.0,9551699
Flying Lonka Ruins Chest Ether,Ice Black Magic Progressive,,0.0,9551699
Flying Lonka Ruins Chest Cabin,Leather Armor,,40.0,9551699
Exdeath's Castle Chest Ether,Black Ability Progressive,,0.0,9551699
Exdeath's Castle Chest Diamond Shield,Toad->Bio->Flare,,0.0,9551699
Exdeath's Castle Chest Ice Shield,Spear,,50.0,9551699
Exdeath's Castle Chest Elixir,GbnPnch->Emision->Missle->Blwfsh,,0.0,9551699
Exdeath's Castle Chest Gale Bow,Summon Ability Progressive,,0.0,9551699
Exdeath's Castle Chest IceBrand,Lamia's Tiara,,1250.0,9551699
Exdeath's Castle Chest Kotetsu,Mythril Sword,,440.0,9551699
Exdeath's Castle Chest 9900,Monk Job Crystal,,0.0,9551699
Exdeath's Castle Chest 8000,L4Qrter->L3Flare->L2Old->L5Doom,,0.0,9551699
Exdeath's Castle Chest DblLance,Protect Drink,,55.0,9551699
Exdeath's Castle Chest Partisan,Crystal Helm,,5250.0,9551699
